{"completed_tick":90,"completion":"COMPLETED","error":null,"execution_id":"EXEC-49eab927","scenario_id":"fixture-smoke","scenario_sha256":"831c75b5537606b349c630f578079a72b09e258fd5af52cca8c52a16b5a51246","schema_version":"0.2.0","snapshots":[{"state":{"enemies_remaining":3,"player_hp":100,"score":0},"tick":0},{"state":{"enemies_remaining":3,"player_hp":80,"score":0},"tick":30},{"state":{"enemies_remaining":2,"player_hp":80,"score":100},"tick":60},{"state":{"enemies_remaining":2,"player_hp":40,"score":100},"tick":90}]}