{"completed_tick":90,"completion":"COMPLETED","error":null,"execution_id":"EXEC-0c9fec79","scenario_id":"fixture-smoke","scenario_sha256":"98155ca97ba03062091b6e85ae6f9bca0e3d7d5494a38c657f8d7892ca930a29","schema_version":"0.2.0","snapshots":[{"state":{"enemies_remaining":3,"player_hp":100,"score":0},"tick":0},{"state":{"enemies_remaining":3,"player_hp":80,"score":0},"tick":30},{"state":{"enemies_remaining":2,"player_hp":80,"score":100},"tick":60},{"state":{"enemies_remaining":2,"player_hp":40,"score":100},"tick":90}]}